Category,Thumbnail,Title,Description,Brand,Stars,Reviews,Price,URL
Home Accessories,"https://images-na.ssl-images-amazon.com/images/I/71b8fh-dQ4L._AC_UL600_SR600,400_.jpg","Queen Size 4 Piece Sheet Set - Comfy Breathable & Cooling Bed Sheets Set - Hotel Luxury Bedding for Women, Men, Kids & Teens",4 PIECE BED SHEET SET: 2 pillow cases and a flat sheet and fitted sheet. Flat Sheet (102”x 90”) Fitted Sheet (80”x 60”) 2 Pillow Cases (20” x 30”).,CGK Unlimited Store,4.4,408175,$24.99,https://www.amazon.com/Queen-Size-Piece-Sheet-Set/dp/B01M16WBW1/ref=zg_bs_g_home-garden_d_sccl_2/137-5741334-0706367?psc=1
Home Accessories,"https://images-na.ssl-images-amazon.com/images/I/81Cn1+lUraL._AC_UL600_SR600,400_.jpg","Amazon Basics Slim, Velvet, Non-Slip Suit Clothes Hangers, Pack of 50, Black","INCLUDES: 50 suit clothes hangers in Black/Silver for keeping shirts, blazers, slacks, and more neatly hung and organized",Amazon Basics Store,4.8,218561,$19.99,https://www.amazon.com/Amazon-Basics-Non-Slip-Clothes-Hangers/dp/B00FXNAAW2/ref=zg_bs_g_home-garden_d_sccl_3/137-5741334-0706367?psc=1
Home Accessories,"https://images-na.ssl-images-amazon.com/images/I/61sS-XIvEXL._AC_UL600_SR600,400_.jpg","Owala FreeSip Insulated Stainless Steel Water Bottle with Straw, BPA-Free Sports Water Bottle, Great for Travel, 24 Oz, Denim",24-ounce insulated stainless-steel water bottle with a FreeSip spout and push-button lid with lock,Owala Store,4.7,93381,$29.99,https://www.amazon.com/Owala-FreeSip-Insulated-Stainless-BPA-Free/dp/B0BZYCJK89/ref=zg_bs_g_home-garden_d_sccl_1/137-5741334-0706367?psc=1
Home Accessories,"https://images-na.ssl-images-amazon.com/images/I/7136-eapqKL._AC_UL600_SR600,400_.jpg","Barossa Design Plastic Shower Liner Clear - Premium PEVA Shower Curtain Liner with Rustproof Grommets and 3 Magnets, Waterpro","OEKO-TEX® STANDARD 100 certified products require every component of a textiles production including all thread, buttons, and trims to be tested against a list of more than 1,000 regulated and unregulated chemicals which may be harmful to human health. The assessment process is globally standardised",Barossa Design Store,4.5,87135,$8.95,https://www.amazon.com/Plastic-Shower-Liner-Clear-Chemical/dp/B08QRFZ6TH/ref=zg_bs_g_home-garden_d_sccl_4/137-5741334-0706367?psc=1
Home Accessories,"https://images-na.ssl-images-amazon.com/images/I/71LOYxu6SAL._AC_UL600_SR600,400_.jpg","upsimples 8x10 Picture Frame, Display Pictures 5x7 with Mat or 8x10 Without Mat, Wall Hanging Photo Frame, Black, 1 Pack","CLASSIC & DURABLE: With sturdy frame, high definition cover, safe packing, upsimples picture frame will protect your photo and give a clear view.",upsimples Store,4.5,31293,$5.99,https://www.amazon.com/upsimples-Picture-Display-Pictures-Without/dp/B0B1CNJL7N/ref=zg_bs_g_home-garden_d_sccl_5/137-5741334-0706367?psc=1
Tech Gadgets,"https://images-na.ssl-images-amazon.com/images/I/71ZvPIpKktL._AC_UL600_SR600,400_.jpg","Amazon Fire HD 10 tablet, built for relaxation, 10.1"" vibrant Full HD screen, octa-core processor, 3 GB RAM, 32 GB, Black","Do what you love, uninterrupted — 25% faster performance than the previous generation and 3 GB RAM are ideal for seamless streaming, reading, and gaming.",Amazon Fire Tablets Store,4.5,34302,$139.99,https://www.amazon.com/Amazon_Fire_HD_10/dp/B0BHZT5S12/ref=zg_bs_g_pc_d_sccl_2/130-6682104-3792943?psc=1
Tech Gadgets,"https://images-na.ssl-images-amazon.com/images/I/61D7vtclcsL._AC_UL600_SR600,400_.jpg","TP-Link Deco X55 AX3000 WiFi 6 Mesh System - Covers up to 6500 Sq.Ft, Replaces Wireless Router and Extender, 3 Gigabit Ports",Wi-Fi 6 Mesh Wi-Fi - Next-gen Wi-Fi 6 AX3000 whole home mesh system to eliminate weak Wi-Fi for good(2×2/HE160 2402 Mbps plus 2×2 574 Mbps),TP-Link Store,4.4,16097,$139.99,https://www.amazon.com/WiFi-6-Mesh-System-AX3000/dp/B09PRB1MZM/ref=zg_bs_g_pc_d_sccl_4/130-6682104-3792943?psc=1
Tech Gadgets,"https://images-na.ssl-images-amazon.com/images/I/615HRY2dnML._AC_UL600_SR600,400_.jpg","Anker USB C Hub, 5-in-1 USBC to HDMI Splitter with 4K Display, 1 x Powered USB-C 5Gbps & 2×Powered USB-A 3.0 5Gbps Data Ports","5-in-1 Connectivity: Equipped with a 4K HDMI port, a 5 Gbps USB-C data port, two 5 Gbps USB-A ports, and a USB C 100W PD-IN port. Note: The USB C 100W PD-IN port supports only charging and does not support data transfer devices such as headphones or speakers.",Anker Store,4.4,14658,$16.98,https://www.amazon.com/Anker-Display-MacBook-Thinkpad-Laptops/dp/B0BQLLB61B/ref=zg_bs_g_pc_d_sccl_3/130-6682104-3792943?psc=1
Tech Gadgets,"https://images-na.ssl-images-amazon.com/images/I/71cWZUr9SVL._AC_UL600_SR600,400_.jpg","Apple 2025 MacBook Air 13-inch Laptop with M4 chip: Built for Apple Intelligence, 13.6-inch Liquid Retina Display, 16GB Unifi","SPEED OF LIGHTNESS — MacBook Air with the M4 chip lets you blaze through work and play. With Apple Intelligence,* up to 18 hours of battery life,* and an incredibly portable design, you can take on anything, anywhere.",Apple Store,4.8,3522,$671.16,https://www.amazon.com/Apple-2025-MacBook-13-inch-Laptop/dp/B0DZD9S5GC/ref=zg_bs_g_pc_d_sccl_1/130-6682104-3792943?psc=1
Tech Gadgets,"https://images-na.ssl-images-amazon.com/images/I/71Ej6sIsNaL._AC_UL600_SR600,400_.jpg","Apple 2025 MacBook Air 15-inch Laptop with M4 chip: Built for Apple Intelligence, 15.3-inch Liquid Retina Display, 16GB Unifi","SPEED OF LIGHTNESS — MacBook Air with the M4 chip lets you blaze through work and play. With Apple Intelligence,* up to 18 hours of battery life,* and an incredibly portable design, you can take on anything, anywhere.",Apple Store,4.8,1312,$963.26,https://www.amazon.com/Apple-2025-MacBook-15-inch-Laptop/dp/B0DZDBDCFH/ref=zg_bs_g_pc_d_sccl_5/130-6682104-3792943?psc=1
